id,drill_pack_id,pack_name,contrast_type,difficulty,tier,word_1_en,word_1_es,word_2_en,word_2_es,target_phoneme_en,target_phoneme_es,contrast_phoneme_en,contrast_phoneme_es,clinical_note_en,clinical_note_es,translation_status
drill_fv_013,pack_f_vs_v,Voicing: /f/ vs /v/,voicing,2,free,half,foca,halve,boca,/f/,/f/,/v/,/b/,Familiar words,El contraste inglés /f/ vs /v/ no es panregionalmente fonémico en español; rediseñar el pack como /f/ vs /b/.,needs_pack_redesign
drill_chdj_015,pack_ch_vs_j,Voicing: /tʃ/ vs /dʒ/,voicing,2,free,etch,grabar al agua fuerte,edge,borde,/tʃ/,,/dʒ/,,Clear minimal pair,El contraste /tʃ/ vs /dʒ/ requiere sustitución española consistente a nivel de pack,needs_pack_redesign
drill_366,drill_pack_19,Vowel Height Back: /ʊ/ vs /uː/ Medial,Vowel Height,3,2,good,bien,gooed,bien,/ʊ/,,/uː/,,Common word vs less common form,El contraste vocálico inglés /ʊ/ vs /uː/ requiere rediseño español a nivel de pack,needs_pack_redesign
drill_399,drill_pack_20,Diphthong Contrasts: /aɪ/ vs /ɔɪ/ Medial,Diphthong,4,3,rile,sacar de quicio,roil,enturbiar,/aɪ/,,/ɔɪ/,,Liquid onset and coda - true minimal pair,El contraste diptongal inglés requiere pares españoles nuevos a nivel de pack,needs_pack_redesign
drill_415,drill_pack_21,Affricate/Fricative: /tʃ/ vs /ʃ/ Initial,Affricate,4,3,change,cambiar,shange,cambiar,/tʃ/,,/ʃ/,,Complex coda with nasal cluster,El contraste /tʃ/ vs /ʃ/ no es panregional en español; rediseñar el pack,needs_pack_redesign
